[{"evidenceId":"data2s-mm-consortium-2013-10-15-23","sourceId":"mega-millions-consortium-history","sourceOrganization":"Mega Millions consortium","canonicalSourceUrl":"https://www.megamillions.com/cmspages/utilservice.asmx/GetDrawingPagingData","sourceDatasetId":null,"retrievedAtUtc":"2026-08-29T20:00:06.566168830Z","rawSha256":"5983d2b208cd8ae7bff8e71acbbc6a6e6f112b5830720fe4d36f52eb66b4fcda","parserVersion":"data2s-mega-official-supplement-projection-v1","termsReference":null},{"evidenceId":"data2s-mm-consortium-conflict-2011-09-23","sourceId":"mega-millions-consortium-history","sourceOrganization":"Mega Millions consortium","canonicalSourceUrl":"https://www.megamillions.com/cmspages/utilservice.asmx/GetDrawingPagingData","sourceDatasetId":null,"retrievedAtUtc":"2026-08-29T20:36:36.393496535Z","rawSha256":"89c5cef88da1e73cf4b951030d6ae8b33f68d161e20e400c63788ab595dd17b7","parserVersion":"data2s-mega-consortium-conflict-parser-v1","termsReference":null},{"evidenceId":"data2s-mm-consortium-correction-2022-05-10","sourceId":"mega-millions-consortium-correction","sourceOrganization":"Mega Millions consortium","canonicalSourceUrl":"https://www.megamillions.com/News/2022/Statement-on-the-May-10%2C-2022%2C-Mega-Millions%C2%AE-Draw.aspx","sourceDatasetId":"news-2022-may-10-correction","retrievedAtUtc":"2026-08-29T20:37:11.448513170Z","rawSha256":"6c95b6486f69c43cef3a7055482a715503391f6f8208eb6de79ce9a1623dd11e","parserVersion":"data2s-mega-2022-correction-parser-v1","termsReference":null},{"evidenceId":"data2s-mm-de-2009-12","sourceId":"delaware-lottery-mega-history","sourceOrganization":"Delaware Lottery","canonicalSourceUrl":"https://www.delottery.com/Winning-Numbers/Search-Winners-Printable/2009/12/MegaMillions","sourceDatasetId":"delaware-mega-monthly-historical-archive","retrievedAtUtc":"2026-08-29T20:00:39.135088976Z","rawSha256":"f08a2761bd292b91626e879d5cde85996bae42ba65f71078ba6cbe48e64b3700","parserVersion":"data2s-mega-official-supplement-projection-v1","termsReference":null},{"evidenceId":"data2s-mm-ny-2002plus-2026-08-28","sourceId":"ny-open-data-mega-millions-history","sourceOrganization":"New York State Gaming Commission / data.ny.gov","canonicalSourceUrl":"https://data.ny.gov/resource/5xaw-6ayf.json?$select=draw_date%2cwinning_numbers%2cmega_ball%2cmultiplier&$where=draw_date+%3e%3d+%222002-05-17T00%3a00%3a00%22+AND+draw_date+%3c%3d+%222026-08-28T23%3a59%3a59%22&$order=draw_date+ASC&$limit=50000","sourceDatasetId":"5xaw-6ayf","retrievedAtUtc":"2026-08-29T19:58:17.300303457Z","rawSha256":"356ae876ac0ba26af7e832973e7c6e0244090236bd206fe3210571138a635095","parserVersion":"data2s-mega-ny-open-data-parser-v1","termsReference":null},{"evidenceId":"data2s-mm-va-2007-12-25","sourceId":"virginia-lottery-mega-history","sourceOrganization":"Virginia Lottery","canonicalSourceUrl":"https://www.valottery.com/api/v1/downloadall?gameId=15","sourceDatasetId":"gameId=15","retrievedAtUtc":"2026-08-29T20:02:37.772035212Z","rawSha256":"e1cce08955fee0c1bd730b181dde17a8b4c648052ff394a80baed5e8678dd156","parserVersion":"data2s-mega-official-supplement-projection-v1","termsReference":null},{"evidenceId":"data2s-mm-va-full-lineage-2026-08-28","sourceId":"virginia-lottery-mega-history","sourceOrganization":"Virginia Lottery","canonicalSourceUrl":"https://www.valottery.com/api/v1/downloadall?gameId=15","sourceDatasetId":"gameId=15","retrievedAtUtc":"2026-08-29T21:19:04.473097646Z","rawSha256":"e1cce08955fee0c1bd730b181dde17a8b4c648052ff394a80baed5e8678dd156","parserVersion":"data2s-mega-virginia-full-history-parser-v1","termsReference":null}]
